{
  "$schema": "https://json-schema.org/draft/2020-12/schema",
  "type": "object",
  "properties": {
    "id": {
      "type": "string",
      "minLength": 1,
      "maxLength": 160
    },
    "kind": {
      "type": "string",
      "enum": [
        "research-brief",
        "evidence-pack",
        "hypothesis",
        "company-model",
        "financial-quality",
        "corporate-governance",
        "valuation-thesis",
        "investment-conclusion",
        "challenge",
        "management-questions",
        "brief",
        "monitor-review"
      ]
    },
    "version": {
      "type": "integer",
      "exclusiveMinimum": 0,
      "maximum": 9007199254740991
    },
    "status": {
      "type": "string",
      "enum": [
        "complete",
        "partial",
        "blocked",
        "not-applicable"
      ]
    },
    "notApplicableReason": {
      "anyOf": [
        {
          "type": "string",
          "minLength": 1
        },
        {
          "type": "null"
        }
      ]
    },
    "mandateId": {
      "type": "string",
      "minLength": 1,
      "maxLength": 160
    },
    "mandateVersion": {
      "type": "integer",
      "exclusiveMinimum": 0,
      "maximum": 9007199254740991
    },
    "scopeIds": {
      "minItems": 1,
      "maxItems": 100,
      "type": "array",
      "items": {
        "type": "string",
        "minLength": 1,
        "maxLength": 160
      }
    },
    "asOf": {
      "type": "string",
      "format": "date-time",
      "pattern": "^(?:(?:\\d\\d[2468][048]|\\d\\d[13579][26]|\\d\\d0[48]|[02468][048]00|[13579][26]00)-02-29|\\d{4}-(?:(?:0[13578]|1[02])-(?:0[1-9]|[12]\\d|3[01])|(?:0[469]|11)-(?:0[1-9]|[12]\\d|30)|(?:02)-(?:0[1-9]|1\\d|2[0-8])))T(?:(?:[01]\\d|2[0-3]):[0-5]\\d:[0-5]\\d(?:\\.\\d+)?(?:Z|([+-](?:[01]\\d|2[0-3]):[0-5]\\d)))$"
    },
    "producedAt": {
      "type": "string",
      "format": "date-time",
      "pattern": "^(?:(?:\\d\\d[2468][048]|\\d\\d[13579][26]|\\d\\d0[48]|[02468][048]00|[13579][26]00)-02-29|\\d{4}-(?:(?:0[13578]|1[02])-(?:0[1-9]|[12]\\d|3[01])|(?:0[469]|11)-(?:0[1-9]|[12]\\d|30)|(?:02)-(?:0[1-9]|1\\d|2[0-8])))T(?:(?:[01]\\d|2[0-3]):[0-5]\\d:[0-5]\\d(?:\\.\\d+)?(?:Z|([+-](?:[01]\\d|2[0-3]):[0-5]\\d)))$"
    },
    "summary": {
      "type": "string",
      "minLength": 1,
      "maxLength": 8000
    },
    "sources": {
      "maxItems": 200,
      "type": "array",
      "items": {
        "type": "object",
        "properties": {
          "id": {
            "type": "string",
            "minLength": 1,
            "maxLength": 160
          },
          "location": {
            "type": "string",
            "minLength": 1
          },
          "locator": {
            "type": "string",
            "minLength": 1
          },
          "publishedAt": {
            "anyOf": [
              {
                "type": "string",
                "format": "date-time",
                "pattern": "^(?:(?:\\d\\d[2468][048]|\\d\\d[13579][26]|\\d\\d0[48]|[02468][048]00|[13579][26]00)-02-29|\\d{4}-(?:(?:0[13578]|1[02])-(?:0[1-9]|[12]\\d|3[01])|(?:0[469]|11)-(?:0[1-9]|[12]\\d|30)|(?:02)-(?:0[1-9]|1\\d|2[0-8])))T(?:(?:[01]\\d|2[0-3]):[0-5]\\d:[0-5]\\d(?:\\.\\d+)?(?:Z|([+-](?:[01]\\d|2[0-3]):[0-5]\\d)))$"
              },
              {
                "type": "null"
              }
            ]
          },
          "availableAt": {
            "anyOf": [
              {
                "type": "string",
                "format": "date-time",
                "pattern": "^(?:(?:\\d\\d[2468][048]|\\d\\d[13579][26]|\\d\\d0[48]|[02468][048]00|[13579][26]00)-02-29|\\d{4}-(?:(?:0[13578]|1[02])-(?:0[1-9]|[12]\\d|3[01])|(?:0[469]|11)-(?:0[1-9]|[12]\\d|30)|(?:02)-(?:0[1-9]|1\\d|2[0-8])))T(?:(?:[01]\\d|2[0-3]):[0-5]\\d:[0-5]\\d(?:\\.\\d+)?(?:Z|([+-](?:[01]\\d|2[0-3]):[0-5]\\d)))$"
              },
              {
                "type": "null"
              }
            ]
          },
          "retrievedAt": {
            "type": "string",
            "format": "date-time",
            "pattern": "^(?:(?:\\d\\d[2468][048]|\\d\\d[13579][26]|\\d\\d0[48]|[02468][048]00|[13579][26]00)-02-29|\\d{4}-(?:(?:0[13578]|1[02])-(?:0[1-9]|[12]\\d|3[01])|(?:0[469]|11)-(?:0[1-9]|[12]\\d|30)|(?:02)-(?:0[1-9]|1\\d|2[0-8])))T(?:(?:[01]\\d|2[0-3]):[0-5]\\d:[0-5]\\d(?:\\.\\d+)?(?:Z|([+-](?:[01]\\d|2[0-3]):[0-5]\\d)))$"
          },
          "accessStatus": {
            "type": "string",
            "enum": [
              "available",
              "partial",
              "unavailable"
            ]
          },
          "synthetic": {
            "type": "boolean"
          }
        },
        "required": [
          "id",
          "location",
          "locator",
          "publishedAt",
          "availableAt",
          "retrievedAt",
          "accessStatus",
          "synthetic"
        ],
        "additionalProperties": false
      }
    },
    "claims": {
      "maxItems": 300,
      "type": "array",
      "items": {
        "type": "object",
        "properties": {
          "id": {
            "type": "string",
            "minLength": 1,
            "maxLength": 160
          },
          "text": {
            "type": "string",
            "minLength": 1
          },
          "material": {
            "type": "boolean"
          },
          "basis": {
            "type": "string",
            "enum": [
              "reported",
              "derived",
              "guidance",
              "estimate",
              "assumption",
              "inference"
            ]
          },
          "sourceIds": {
            "maxItems": 30,
            "type": "array",
            "items": {
              "type": "string",
              "minLength": 1,
              "maxLength": 160
            }
          },
          "calculation": {
            "anyOf": [
              {
                "type": "object",
                "properties": {
                  "method": {
                    "type": "string",
                    "minLength": 1
                  },
                  "inputIds": {
                    "minItems": 1,
                    "type": "array",
                    "items": {
                      "type": "string",
                      "minLength": 1,
                      "maxLength": 160
                    }
                  }
                },
                "required": [
                  "method",
                  "inputIds"
                ],
                "additionalProperties": false
              },
              {
                "type": "null"
              }
            ]
          },
          "rationale": {
            "anyOf": [
              {
                "type": "string",
                "minLength": 1
              },
              {
                "type": "null"
              }
            ]
          }
        },
        "required": [
          "id",
          "text",
          "material",
          "basis",
          "sourceIds",
          "calculation",
          "rationale"
        ],
        "additionalProperties": false
      }
    },
    "dependencies": {
      "maxItems": 100,
      "type": "array",
      "items": {
        "type": "object",
        "properties": {
          "id": {
            "type": "string",
            "minLength": 1,
            "maxLength": 160
          },
          "version": {
            "type": "integer",
            "exclusiveMinimum": 0,
            "maximum": 9007199254740991
          },
          "changed": {
            "type": "boolean"
          }
        },
        "required": [
          "id",
          "version",
          "changed"
        ],
        "additionalProperties": false
      }
    },
    "checks": {
      "maxItems": 100,
      "type": "array",
      "items": {
        "type": "object",
        "properties": {
          "name": {
            "type": "string",
            "minLength": 1
          },
          "result": {
            "type": "string",
            "enum": [
              "pass",
              "fail",
              "not-run"
            ]
          },
          "blocking": {
            "type": "boolean"
          },
          "detail": {
            "type": "string",
            "minLength": 1
          }
        },
        "required": [
          "name",
          "result",
          "blocking",
          "detail"
        ],
        "additionalProperties": false
      }
    },
    "criticalUnknowns": {
      "maxItems": 100,
      "type": "array",
      "items": {
        "type": "string",
        "minLength": 1
      }
    },
    "nextActions": {
      "minItems": 1,
      "maxItems": 30,
      "type": "array",
      "items": {
        "type": "object",
        "properties": {
          "task": {
            "type": "string",
            "minLength": 1
          },
          "kind": {
            "type": "string",
            "enum": [
              "read",
              "calculate",
              "challenge",
              "user-input",
              "review",
              "watch"
            ]
          },
          "completionCondition": {
            "type": "string",
            "minLength": 1
          },
          "dueAt": {
            "anyOf": [
              {
                "type": "string",
                "format": "date-time",
                "pattern": "^(?:(?:\\d\\d[2468][048]|\\d\\d[13579][26]|\\d\\d0[48]|[02468][048]00|[13579][26]00)-02-29|\\d{4}-(?:(?:0[13578]|1[02])-(?:0[1-9]|[12]\\d|3[01])|(?:0[469]|11)-(?:0[1-9]|[12]\\d|30)|(?:02)-(?:0[1-9]|1\\d|2[0-8])))T(?:(?:[01]\\d|2[0-3]):[0-5]\\d:[0-5]\\d(?:\\.\\d+)?(?:Z|([+-](?:[01]\\d|2[0-3]):[0-5]\\d)))$"
              },
              {
                "type": "null"
              }
            ]
          },
          "trigger": {
            "anyOf": [
              {
                "type": "string",
                "minLength": 1
              },
              {
                "type": "null"
              }
            ]
          },
          "activationStatus": {
            "anyOf": [
              {
                "type": "string",
                "enum": [
                  "planned",
                  "active"
                ]
              },
              {
                "type": "null"
              }
            ]
          },
          "activationId": {
            "anyOf": [
              {
                "type": "string",
                "minLength": 1,
                "maxLength": 160
              },
              {
                "type": "null"
              }
            ]
          }
        },
        "required": [
          "task",
          "kind",
          "completionCondition",
          "dueAt",
          "trigger",
          "activationStatus",
          "activationId"
        ],
        "additionalProperties": false
      }
    }
  },
  "required": [
    "id",
    "kind",
    "version",
    "status",
    "notApplicableReason",
    "mandateId",
    "mandateVersion",
    "scopeIds",
    "asOf",
    "producedAt",
    "summary",
    "sources",
    "claims",
    "dependencies",
    "checks",
    "criticalUnknowns",
    "nextActions"
  ],
  "additionalProperties": false
}
